qwen3.6-27B-awq/inductor_cache_qwen36_awq/triton/0/BATCP75KRXBWKU3DDNDEFFDQ7HPZCNZ6PST7VAXFLRIJYNOYJJJA/chunk_gated_delta_rule_fwd_kkt_solve_kernel.autotune.json
{"key": [24, 8, 128, 16, "torch.bfloat16", "torch.float32", "torch.float32", "torch.bfloat16", "torch.int32", "torch.int32"], "configs_timings": [[{"kwargs": {"BK": 32}, "num_warps": 1, "num_ctas": 1, "num_stages": 3, "maxnreg": null, "pre_hook": null, "ir_override": null}, [0.02783999964594841, 0.027168000116944313, 0.028147200122475624]], [{"kwargs": {"BK": 32}, "num_warps": 2, "num_ctas": 1, "num_stages": 3, "maxnreg": null, "pre_hook": null, "ir_override": null}, [0.036720000207424164, 0.036159999668598175, 0.03705599904060364]], [{"kwargs": {"BK": 32}, "num_warps": 4, "num_ctas": 1, "num_stages": 3, "maxnreg": null, "pre_hook": null, "ir_override": null}, [0.03734400123357773, 0.036876801401376724, 0.037779200822114944]], [{"kwargs": {"BK": 64}, "num_warps": 1, "num_ctas": 1, "num_stages": 3, "maxnreg": null, "pre_hook": null, "ir_override": null}, [0.02579200081527233, 0.02521600015461445, 0.026176000013947487]], [{"kwargs": {"BK": 64}, "num_warps": 2, "num_ctas": 1, "num_stages": 3, "maxnreg": null, "pre_hook": null, "ir_override": null}, [0.024960000067949295, 0.024396799504756927, 0.02534399926662445]], [{"kwargs": {"BK": 64}, "num_warps": 4, "num_ctas": 1, "num_stages": 3, "maxnreg": null, "pre_hook": null, "ir_override": null}, [0.03500799834728241, 0.03436800092458725, 0.035360001027584076]]]}