qwen3.6-27B-awq/inductor_cache_qwen36_awq/triton/1/BATCP75KRXBWKU3DDNDEFFDQ7HPZCNZ6PST7VAXFLRIJYNOYJJJA/chunk_gated_delta_rule_fwd_kkt_solve_kernel.autotune.json
{"key": [24, 8, 128, 16, "torch.bfloat16", "torch.float32", "torch.float32", "torch.bfloat16", "torch.int32", "torch.int32"], "configs_timings": [[{"kwargs": {"BK": 32}, "num_warps": 1, "num_ctas": 1, "num_stages": 3, "maxnreg": null, "pre_hook": null, "ir_override": null}, [0.026944000273942947, 0.02691200003027916, 0.027116799727082253]], [{"kwargs": {"BK": 32}, "num_warps": 2, "num_ctas": 1, "num_stages": 3, "maxnreg": null, "pre_hook": null, "ir_override": null}, [0.03606399893760681, 0.03593600168824196, 0.03622400015592575]], [{"kwargs": {"BK": 32}, "num_warps": 4, "num_ctas": 1, "num_stages": 3, "maxnreg": null, "pre_hook": null, "ir_override": null}, [0.03667199984192848, 0.036607999354600906, 0.036896001547575]], [{"kwargs": {"BK": 64}, "num_warps": 1, "num_ctas": 1, "num_stages": 3, "maxnreg": null, "pre_hook": null, "ir_override": null}, [0.025551999919116497, 0.024927999824285507, 0.02579200081527233]], [{"kwargs": {"BK": 64}, "num_warps": 2, "num_ctas": 1, "num_stages": 3, "maxnreg": null, "pre_hook": null, "ir_override": null}, [0.024240000173449516, 0.02412799932062626, 0.0244159996509552]], [{"kwargs": {"BK": 64}, "num_warps": 4, "num_ctas": 1, "num_stages": 3, "maxnreg": null, "pre_hook": null, "ir_override": null}, [0.03409599885344505, 0.03399040102958679, 0.034304000437259674]]]}